author,title,description,url,urlToImage,publishedAt,content,id,source_name,rank,sequence,sentiment,score
"Hannah L. F. Cooper, Courtney R. Yarbrough, Umedjon Ibragimov, Janet Cummings, Danielle Haley",Medicaid Expansion Alone Won't Stop the Opioid Overdose Crisis,"Expanding the state and federal insurance program helps prevent overdoses. But that only happens with enough treatment, and legal reform, to make it work",https://www.scientificamerican.com/article/medicaid-expansion-alone-wont-stop-the-opioid-overdose-crisis/,https://static.scientificamerican.com/dam/m/7cf956f62b3f5998/original/GettyImages-1169935332.jpg?w=1200,2024-03-12T12:00:00Z,"Drug overdoses have claimed more than one million lives in the U.S. since 1999, most tied to illicit opioids such as heroin and the nonmedical use of fentanyl. Although people from all walks of life die each day from overdoses, poverty stands out as a driver of this staggering toll. The risk of dying from an overdose is 36 percent higher among people living at or below the poverty line, compared with people living at five times that line, a typical middle class income.
That’s why expansion of Medicaid, the state and federal health insurance program for low-income individuals, has been hailed as an essential policy to prevent this disproportionate suffering. Implemented in 40 states, Medicaid expansion is a pillar of the Affordable Care Act that extends its coverage to all adults living at or below 138 percent of the federal poverty line (equivalent to a yearly income of $20,120 for an individual). Health insurance can help tackle the overdose crisis because it allows people in need to afford substance use disorder treatment, and treatment is a highly effective way to reduce overdoses.
So far, however, Medicaid expansion has not fully realized its lifesaving potential for helping to end the overdose epidemic. One reason why is that it takes more than insurance alone to stave off overdoses.
If you're enjoying this article, consider supporting our award-winning journalism bysubscribing. By purchasing a subscription you are helping to ensure the future of impactful stories about the discoveries and ideas shaping our world today.
In fact, our recent analysis of all overdose deaths in the U.S. from 2008 to 2018 found that Medicaid expansion did not prevent fatal overdoses among people facing poverty; the opioid overdose mortality rate was the same—about 14.5 deaths per 100,000 residents—in states that expanded Medicaid and in states that did not.
This was not the result we expected.
So, we dug deeper by analyzing nationwide data gathered by the Centers for Disease Control and Prevention on people who inject drugs. We looked at 19,946 people who subsisted below 138 percent of the poverty line (Medicaid expansion’s eligibility threshold). Some of the states we analyzed had expanded Medicaid, while others had not, allowing us to compare individuals who injected drugs in states that had and had not expanded coverage.
These comparisons highlight a breakdown in a key pathway that should link Medicaid expansion to improved substance use disorder treatment and thus to reduced overdoses. In a sign of the policy’s success, we found
 that insurance coverage rates increased by 19 percentage points among people facing poverty who inject drugs and live in states that had expanded Medicaid, while rates remained unchanged among similar residents of states that had not. Moreover, we also found
 people experienced a nine percentage point increase in their probability of getting needed medical care if they lived in expansion states, with no parallel bump in states that did not expand Medicaid.
Strikingly, increased rates of insurance did not,however, lead to increased utilization of substance use disorder treatment; we found
 no difference in treatment use across these two groups of people who inject drugs. Other studies have reached similar conclusions.
So, why might health insurance not be enough to effectively link people to treatment? First, the U.S. has long suffered a marked shortage of treatment slots, so insured individuals who want treatment may still not be able to get it. For example, residential treatment programs operated at 90 percent capacity in 2022, but about three quarters of the people needing treatment that year did not receive it. We need investments to increase treatment capacity, particularly in low-income and rural areas, which have been historically underresourced.
Second, even with enhanced capacity, Medicaid expansion can only substantially impact overdoses among individuals facing poverty if treatment providers accept its insurance. Unfortunately, in 2020 only 71 percent of treatment facilities nationwide accepted Medicaid. Residents of expansion states do not fare better; a previous study by one of us found
 that Medicaid expansion did not result in greater increases in treatment programs accepting Medicaid in expansion states versus states that had not expanded. Low reimbursement rates are a longstanding barrier to provider acceptance of Medicaid. In 2021, the national average Medicaid reimbursement for methadone treatment—a common treatment for opioid use disorder—was nearly half that of Medicare, the federal insurance program for people age 65 and over. This Medicaid–Medicare reimbursement gap was larger than that seen for other services, including primary care. To help ensure that Medicaid expansion truly translates into increased financial access to substance use disorder treatment, policy makers must increase reimbursement for providers.
These days, people with an opioid use disorder don’t have to rely only on formal programs for treatment; they can also access the pharmaceutical treatment buprenorphine through their primary care physicians and other health care providers. Buprenorphine is a highly effective medication to treat opioid use disorder that also greatly reduces overdose risk. “Secret shopper” studies in which undercover researchers pose as potential patients, however, have found that potential patients struggle to get appointments with physicians who prescribe buprenorphine when they disclose that they are on Medicaid. Increasing Medicaid reimbursement rates, bolstering buprenorphine prescribing among providers within federally qualified health centers (which provide care for low-income individuals) and expanding the role of telemedicine are three pathways toward effectively linking insured people in need to lifesaving treatment.
Finally, even insured individuals who can access treatment may still not be able to use it because of oppressive policies. Methadone, for example, is a highly effective treatment for opioid use disorder that also reduces overdoses. Federal law, however, requires that only specialized clinics can offer it, and that patients must come in person daily for observed medication dosing. These mandates are contemporary practices of the war on drugs, which created barriers to care by punishing even public health programming for drug-related harms. Daily travel to clinics may be impossible for people who have jobs, for people who lack transportation and for those juggling childcare or eldercare. These barriers are common among impoverished people who use drugs, particularly those who are Black, Indigenous or people of color, or those who live in rural communities.
During the COVID pandemic, the federal emergency declaration temporarily replaced these punitive policies with a more patient-centered model. Emergency policies permitted some patients to take home up to a 28-day supply of methadone. While this policy has remained in effect even after the federal emergency declaration ended, it is only temporary. The Department of Health and Human Services should make this policy permanent, and support states and treatment programs as they revise policies to support this federal change.
Our study showed expansion was successful at enrolling people facing poverty who use drugs in Medicaid, and that it also helped them access needed medical care. However, our analysis also served as a compelling reminder that insurance coverage alone is insufficient to reverse the overdose crisis for this vulnerable population, because it is not adequately connecting those in need to substance use disorder treatment. We must bolster treatment to meet demand, expand program and provider acceptance of Medicaid, and permanently relax oppressive methadone policies before another million lives are lost.
This is an opinion and analysis article, and the views expressed by the author or authors are not necessarily those of Scientific American.",,Scientific American,Scientific & High Quality,"Expanding the state and federal insurance program helps prevent overdoses. But that only happens with enough treatment, and legal reform, to make it work",public policy and legislation,0.44200778007507324
Lydialyle Gibson,We have treatments for opioid addiction that work. So why is the problem getting worse?,We have treatments for opioid addiction that work. So why is the problem getting worse?,https://www.vox.com/the-highlight/2024/1/16/24033590/treatment-opioid-addiction-crisis-2024,https://cdn.vox-cdn.com/thumbor/G58eZIosrA92W-pKDv_WvGPb0FI=/0x38:1920x1043/fit-in/1200x630/cdn.vox-cdn.com/uploads/chorus_asset/file/25217739/Vox_XiaoHuaYang.jpg,2024-02-12T14:29:36Z,"Xiao Hua Yang for Vox

 


 Opioid addiction doesn’t get as many headlines as it used to, but the crisis is as bad as ever. It doesn’t have to be. The opioid crisis doesn’t get as many headlines as it used to before Covid-19, but the news remains stubbornly, shockingly bad. 
Decades into the deadliest drug overdose epidemic in American history, people are dying at higher rates than ever. Between 2017 and 2021, the number of overdose deaths involving opioids jumped from 47,600 to 80,411 — many more Americans than are killed each year by guns or cars. The surge has been largely driven by powerful synthetics like fentanyl, an opioid 50 times more potent than heroin. 
Provisional data from the Centers for Disease Control and Prevention show nearly as many opioid-involved overdose deaths in 2022, at 79,770. Overdoses in Black, American Indian, and Latinx communities have been rising even faster, widening the mortality gap between white people and people of color. In 2020, Black men 65 and older died of overdoses at seven times the rate of white men in the same age range. 
Meanwhile, the number of Americans struggling with opioid addiction remains staggering. In 2022, 6.1 million people 12 and older had an opioid use disorder, according to the Substance Abuse and Mental Health Services Administration’s most recent annual survey, while 8.9 million reported misusing opioids within the past year. 
Looking at these statistics, I thought back to something that addiction specialist Sarah Wakeman told me when I was reporting on the opioid crisis five years ago. “Most people get better,” Wakeman, who is the senior medical director for substance use disorder at Mass General Brigham, said then. “That’s what we don’t ever talk about in the opioids conversation.” 
When she says “most people,” she means most people who get long-term medication-assisted treatment (MAT), widely considered the gold standard in addiction care. It combines regular counseling and behavioral therapy with the medication methadone or buprenorphine (often prescribed under the brand name Suboxone). Both contain synthetic opioid compounds, which prevent withdrawal and cravings, and they can lower overdoses by as much as 76 percent. (A third medication, less often used, is naltrexone, which blocks the high from opioids.) 
The philosophy of MAT — a departure from the moralizing, abstinence-based rehab and 12-step programs that dominated addiction care for most of the 20th century — began to take shape in the early 2000s, when the Food and Drug Administration approved buprenorphine and a federal law authorized primary care physicians to prescribe it. 
MAT shifted the treatment paradigm dramatically. Now, every overdose death is a tragedy, Wakeman told me, not because opioid addiction is unsolvable but because, like so many other chronic illnesses, it’s now very treatable. 
So why have we failed to stop or even significantly slow the opioid crisis? Why do nearly 90 percent of those with opioid use disorder still lack access to evidence-based treatment like MAT? 
This fall, I got back in touch with Wakeman and posed this question. Is the problem us, I asked her, or is it the opioids? “Oh, it’s definitely us,” she said. The addiction crisis is as much an “ideological challenge” as it is a medical one. 
“We, as a society, have spent more than 100 years thinking of and building policies and systems and punishments to address addiction as if it were an issue of morality,” Wakeman said. “And so even though now we’re starting to talk about it as a public health issue, our policies, our clinical approaches, our care models, our funding, really reflect this idea that we actually think people are doing something bad and so we should make it really hard on them.”
This punitive mindset contributes to a disproportionate emphasis on detox, “which happens to be the most lucrative, least effective element of recovery,” as Walter Ling, a UCLA psychiatrist and neurologist whose research helped pave the way for FDA approval of buprenorphine and other opioid addiction medications, put it in a recent op-ed. Even now, many drug rehab centers stress detoxification, meaning going off opioids rapidly, over MAT. A 2020 nationwide survey of inpatient programs found that only 29 percent offered a long-term MAT option; only one in eight residential treatment facilities for adolescents offered buprenorphine for long-term treatment, according to a study last June. 
Nearly every clinician I spoke to offered some version of this same observation about how culture and ideology restrict addiction care. “The main thing that’s holding us back is stigma,” said Brown University epidemiologist Josiah Rich, an adviser to the Rhode Island task force on overdoses, who has spent decades providing HIV and addiction care to people locked up in the state’s prisons. 
Physician and anthropologist Kimberly Sue, a professor at Yale and the author of Getting Wrecked: Women, Incarceration, and the American Opioid Crisis, told me about treating young people jailed at Rikers Island whose families had cut them off or kicked them out for using drugs. “The US is extremely culturally punitive,” she said. “You know, ‘Pull yourself up by your own bootstraps.’ ‘You made your bed, you lie in it.’ … We’re told that you’re a loser, you don’t deserve to live because you use drugs. You don’t deserve to be healthy.” 
Our approach to treatment hasn’t caught up with the science of what works best. “Until the medications came around, our treatment for opioid addiction was mostly a failure,” Ling told me. “Yet we put our philosophy, our idea, ahead of science, ahead of what we know.” That trickles down into how people interact with the health care system — and how structural barriers like racism and poverty compound the damage for those most susceptible to addiction. 
The war on drugs laid the foundation for dysfunctional addiction treatment
The face of opioid addiction in America changed dramatically over the past two decades. As overdoses soared in white and rural communities and the crisis was no longer concentrated in cities or communities of color, public discourse around addiction shifted. Experts and policymakers began talking urgently about “deaths of despair” among working-class white people, and a surge of sympathetic media attention sought to understand the problem through this new wave of victims. Americans increasingly began to see addiction the same way medical authorities had for decades — as an illness. 
Even so, our treatment paradigm has not caught up. Perhaps the clearest example of how Americans’ cultural mindset limits access to treatment is the onerous regulation of methadone. Patients can receive the medication only at federally certified clinics, which tend to be located in impoverished or high-crime neighborhoods. Most patients must appear at the clinic daily for months or years before they’re allowed to take home even a small number of doses. This means waiting in line, often for hours, missing appointments and work, having to arrange for child care. For some patients, it also means long commutes, sometimes across state lines. 
In stark contrast, buprenorphine can be prescribed in doctors’ offices and dispensed by pharmacies. Although the overdose risk with methadone is slightly higher than for buprenorphine, it is stigma, not science, that guides methadone regulations. The medication was initially introduced in the US in 1947 as a pain reliever and cough suppressant; researchers established its effectiveness at treating opioid addiction during the 1960s, amid a spike in heroin use that devastated Black urban communities. Back then, even more than now, Americans viewed addiction through the lens of criminality and deviance rather than disease, so federal regulations put in place in the early 1970s, just as Richard Nixon declared the “war on drugs,” walled off methadone from mainstream medical settings. That’s where it remains today, even though in countries like Canada, the UK, and Australia, where primary care doctors have been prescribing methadone for decades, it’s treated more like a normal medication.
The long lines outside methadone clinics is one of the main reasons people drop out of or never begin treatment with the medication. Because of these restrictions, methadone is “legendarily hated” among drug users, New York University sociologist David Frank, who is in recovery himself and has been taking methadone for 20 years, told me. 
In a recent study he published, one participant compared methadone treatment to “liquid handcuffs,” while another described the degrading experience of being told to keep waiting in line after her water broke. “Treatment is not set up to meet the actual needs of the population,” Frank said. “In fact, it’s a barrier to meeting those needs.” Most people come to treatment not because of a commitment to abstinence or even to cure a disease, but “to deal with the fact that the drug they’re dependent on is highly criminalized,” he said. “In my research, this comes up time and again. I ask people, why did you get on methadone? And they always tell the same story as mine: ‘I’m dope sick every day, it’s impossible. I get arrested, I’m scared, my life is falling apart.’ It’s a very pragmatic response. Methadone helps reduce those problems.” 
The punitive regulations flow largely from methadone’s history, providers say, from a time when heroin use was closely associated with Black Americans. When buprenorphine received FDA approval 40 years later, the opioid crisis was hitting white America, too. “People’s perceptions about methadone are really frozen in history,” said Paul Joudrey, a Pittsburgh-based addiction care doctor who, along with Frank, is on the board of the National Coalition to Liberate Methadone. 
Buprenorphine prescribers are far more common in segregated white communities, while methadone clinics are more prevalent in Black and Hispanic neighborhoods. Patients who are white, wealthy, and well-educated are more likely than Black or Hispanic patients to receive buprenorphine. Patients of color are often directed instead to methadone clinics — and even when they do receive buprenorphine, the average course of treatment is shorter. 
Our very ideas of what it means to recover are still bound up with the stigmatized, criminalized history of addiction. A common misconception among the public, experts told me, and even some care providers and people who use drugs themselves, is that recovery with buprenorphine or methadone isn’t “real” recovery; that it just replaces one addiction with another. 
“We think of addiction, which is a lifetime-long problem, as being like pneumonia or some other kind of infection,” Ling said. “You come off [the drugs], and then people say, ‘Why can’t they just go back to their old self?’ But they can’t. Substance use has irreversible effects on the body and the brain.” Some people need to stay on MAT for years or decades — and that’s okay, Ling says. 
Some experts push this argument further, challenging the notion that being in recovery necessarily means getting off drugs altogether. “My goals for my patients are that they are alive, healthy, and able to have a connected, meaningful life,” said Sue of Yale, who is the former medical director of the National Harm Reduction Coalition. “I do not care how much or what they use in order to achieve that.” For some people, that means strict sobriety; for others, it might mean using drugs less often, or using certain drugs but not others. Sue never mandates abstinence. “The first thing I always ask my patients is, ‘What are your goals, in regards to your substance use?’” Sue told me. “Most people have never been asked that question.”
Providers on the cutting edge of addiction treatment are increasingly moving toward this approach, with greater emphasis on harm reduction, an evidence-based, albeit controversial, strategy that aims to minimize the damaging effects of drug use rather than fixating on forcing patients to get “clean.” In a society raised on the concept of total abstinence from drugs, that can be a tough sell politically — but the idea is that opioid addiction is a serious illness, and breaking an addiction to opioids is extremely hard (as Ling said, patients can’t simply go back to their old selves). Harm reduction is in part about finding an approach that will actually work for people: reaching those who might not otherwise seek care, empowering them to make their own choices, and helping them work toward incremental changes. 
Harm reduction measures include safe consumption sites (where people use drugs under the supervision of trained medical professionals), syringe exchange programs (where users can obtain clean needles), distribution programs for naloxone (a medication that can reverse an overdose), and fentanyl test strips (which can prevent overdoses by detecting whether someone’s drugs contain fentanyl). “Any positive change — that’s sort of the mantra of harm reduction,” said Sue. 
Cutting-edge treatments don’t mean much if patients can’t access them
A visit last fall with one of Sarah Wakeman’s patients during a checkup in her Boston clinic gave me a glimpse of addiction treatment — and the barriers that work against it. Samuel (who’s being referred to by a pseudonym to protect his privacy) first encountered opioids in high school, when his doctor prescribed them (“pretty heavily,” he said) for a wrestling injury. “I found out that I liked it,” he said, and he became addicted in college, after experimenting with drugs with a roommate. Before long, he wound up on heroin. For several years, his life unraveled: debt, lost jobs, defaulted loans, an arrest, multiple trips to rehab and 12-step programs. 
Samuel found his way to Wakeman’s practice a few years ago. He’s stable now, taking buprenorphine — with a job and an apartment and a new puppy. But he told me he’d encountered judgment and distrust from many of the people he initially looked to for help, even those whose job it is to help him, like doctors and psychiatrists. Even now, pharmacists sometimes hesitate to refill his buprenorphine prescription, leading him to stash extra doses so he doesn’t run out, he said, which can be “dangerous behavior” for someone with an addiction. 
That stigma compounds the hurdles that are already a part of buprenorphine treatment. Although it’s intended to be a long-term therapy, as a controlled substance, it is prescribed in small increments that must be refilled every few days or weeks. If he’d been any less motivated to get better, he told me, he’s not sure he would have made it — or, he added, if he’d been any less privileged: Samuel is an educated white man in his mid-30s who grew up in a family of medical professionals. 
The logistical and ideological obstacles to treatment are, of course, tied to the kinds of people who bear the brunt of the epidemic — those who exist, in one way or another, on the margins of society. Addiction is one of a cluster of interconnected crises unfolding across the country: homelessness, poverty, mental illness, untreated trauma, an epidemic of loneliness. Opioid overdoses spiked in 2020 during the onslaught of Covid-19, in part because people were isolated from each other as well as from treatment. Racism plays a major role in limiting access to treatment, too, as does mass incarceration. There’s a shortage of addiction care providers, particularly in rural America, where the scarcity of basic primary care for all types of patients is increasingly dire. 
Until recently, nearly 60 percent of rural people lived in counties without a single doctor authorized to prescribe buprenorphine. (That changed last year, after a law requiring providers to obtain a special waiver to dispense the medication was eliminated.) In Madison, Wisconsin, where Elizabeth Salisbury-Afshar practices addiction medicine, it’s not unusual for patients to travel one or two hours each way to her clinic “for an appointment that’s maybe 30 minutes long,” she says. “It’s a full-day endeavor. But folks don’t have another choice.” 
